1,JTBDJTBDJTBDJTBDJTBDJTBDJTBDJTBDJTBDJTBDJTBDJTBDJTBDJTBDJTBDJTBDJTBDJTBDJTBDJTBDJTBDJTBDJTBDJTBDJTBDJTBDJTBDJTBDJTBDJTBDJTBD
2,Comm TasksComm TasksComm TasksComm TasksComm TasksComm TasksComm TasksComm TasksComm TasksComm TasksComm TasksComm TasksComm TasksComm TasksComm TasksComm Tasks
3,Real LivesReal LivesReal LivesReal LivesReal LivesReal LivesReal LivesReal LivesReal LivesReal LivesReal LivesReal LivesReal LivesReal LivesReal LivesReal LivesReal LivesReal LivesReal LivesReal LivesReal LivesReal Lives
4,Media IdeaMedia IdeaMedia IdeaMedia IdeaMedia IdeaMedia IdeaMedia IdeaMedia IdeaMedia IdeaMedia IdeaMedia IdeaMedia IdeaMedia IdeaMedia IdeaMedia IdeaMedia Idea
5,Touchpoint ShortlistTouchpoint ShortlistTouchpoint ShortlistTouchpoint ShortlistTouchpoint ShortlistTouchpoint ShortlistTouchpoint ShortlistTouchpoint Shortlist
6,Budget Allocation & MappingBudget Allocation & MappingBudget Allocation & MappingBudget Allocation & MappingBudget Allocation & MappingBudget Allocation & MappingBudget Allocation & Mapping
7,PhasingPhasingPhasingPhasingPhasingPhasingPhasingPhasingPhasingPhasingPhasingPhasing
8,Final PlanFinal PlanFinal PlanFinal PlanFinal PlanFinal PlanFinal PlanFinal PlanFinal PlanFinal PlanFinal PlanFinal PlanFinal PlanFinal PlanFinal PlanFinal PlanFinal PlanFinal PlanFinal Plan
9,OutcomOutcomOutcomOutcomOutcomOutcomOutcomOutcomOutcomOutcomOutcomOutcomOutcomOutcomOutcomOutcomOutcomOutcomOutcomOutcomOutcomOutcomOutcomOutcomOutcomOutcomOutcomOutcomOutcomOutcomOutcomOutcom